{
  "$id": "https://posthog-impact.local/schemas/candidate_episodes.schema.json",
  "$schema": "https://json-schema.org/draft/2020-12/schema",
  "additionalProperties": false,
  "properties": {
    "edge_types": {
      "arrow_type": "list<element: string>",
      "type": [
        "array",
        "null"
      ]
    },
    "episode_edges_version": {
      "arrow_type": "string",
      "type": [
        "string",
        "null"
      ]
    },
    "episode_id": {
      "arrow_type": "string",
      "type": [
        "string",
        "null"
      ]
    },
    "pr_count": {
      "arrow_type": "int64",
      "type": [
        "integer",
        "null"
      ]
    },
    "pr_numbers": {
      "arrow_type": "list<element: int64>",
      "type": [
        "array",
        "null"
      ]
    },
    "root_pr_number": {
      "arrow_type": "int64",
      "type": [
        "integer",
        "null"
      ]
    }
  },
  "title": "candidate_episodes",
  "type": "object",
  "x-pipeline-version": "1.0.0",
  "x-schema-version": "1.0.0"
}
